{
  "business": {
    "id": "213655",
    "name": "Tock Restaurant Group",
    "domainName": "Tock Restaurant Group",
    "locale": "en-US",
    "currencyCode": "USD",
    "timeZone": "America/Chicago"
  },
  "note": [
    {
      "note": "Celebrating an anniversary; window table preferred.",
      "lastUpdatedBy": {
        "id": "374396",
        "email": "guest@example.com",
        "firstName": "Jordan",
        "lastName": "Rivera",
        "phone": "3125550142",
        "phoneCountryCode": "US",
        "zipCode": "60607",
        "imageUrl": "https://www.exploretock.com/example",
        "isoCountryCode": "US",
        "loyaltyProgramCardNumber": "example",
        "loyaltyProgramAccountId": "905368"
      },
      "lastUpdatedAtTimestampMs": "example",
      "previousVersionId": "787406",
      "noteType": {}
    }
  ],
  "tag": [
    "VIP"
  ],
  "spend": {
    "totalSpendCents": "example",
    "averageSpendPerVisitCents": "example",
    "spendInLastYearCents": "example"
  }
}